{
  "$schema": "../../../../../docs/packs/schema/course-labels.schema.json",
  "sections": {
    "s1": {
      "title": "Misingi",
      "level": "Wanaoanza",
      "description": "Salamu, familia, chakula, namba na saa, mahali, nyumbani, maisha ya kila siku na afya."
    },
    "s2": {
      "title": "Maisha ya kila siku",
      "level": "Ngazi ya awali",
      "description": "Eleza vitu, vaa nguo, saidia nyumbani, majira, wanyama, kazi, shule na usafiri."
    },
    "s3": {
      "title": "Mazungumzo",
      "level": "Kabla ya kati",
      "description": "Kataa, uliza maswali, zungumza kuhusu yaliyopita na yajayo, hisia, burudani, simu na upishi."
    },
    "s4": {
      "title": "Jamii na utamaduni",
      "level": "Kati",
      "description": "Pwani ya Waswahili, kijiji na kilimo, sherehe, muziki, imani, biashara, mazingira na jamii."
    },
    "s5": {
      "title": "Mzungumzaji hodari",
      "level": "Juu ya kati",
      "description": "Linganisha, waza, simulia hadithi, tumia methali, fuatilia habari, kabili dharura, onyesha heshima na furahia hadithi za jadi."
    }
  },
  "units": {
    "u1": {
      "title": "Salamu",
      "description": "Salimia, wasalimie wazee kwa heshima, jitambulishe na hesabu hadi kumi."
    },
    "u2": {
      "title": "Familia na marafiki",
      "description": "Zungumza kuhusu familia yako, sema ulicho nacho na eleza watu."
    },
    "u3": {
      "title": "Chakula na sokoni",
      "description": "Taja vyakula vya kila siku, sema una njaa au kiu, na nunua sokoni."
    },
    "u4": {
      "title": "Namba na saa",
      "description": "Hesabu hadi mia, sema saa kwa njia ya Kiswahili na zungumza kuhusu leo na kesho."
    },
    "u5": {
      "title": "Kuzunguka",
      "description": "Uliza vitu viko wapi, toa maelekezo na safiri kwa matatu, daladala au boda boda."
    },
    "u6": {
      "title": "Nyumbani",
      "description": "Eleza nyumba yako, sema kilichopo na kisichokuwepo, na taja rangi."
    },
    "u7": {
      "title": "Siku yangu",
      "description": "Taja siku za wiki, eleza ratiba yako na zungumza kuhusu hali ya hewa."
    },
    "u8": {
      "title": "Mwili na afya",
      "description": "Taja sehemu za mwili, sema kinachouma, mwone daktari na umtakie mtu afya njema."
    },
    "u9": {
      "title": "Kueleza vitu",
      "description": "Sema vitu na watu walivyo: wazuri au wabaya, wapya, wakubwa au wadogo, wazito au wepesi."
    },
    "u10": {
      "title": "Nguo",
      "description": "Taja nguo zako, vaa kulingana na hali ya hewa na nunua kitu kipya."
    },
    "u11": {
      "title": "Kusaidia nyumbani",
      "description": "Omba na uombwe: njoo, keti, leta, safisha, osha na saidia kazi za nyumbani."
    },
    "u12": {
      "title": "Hali ya hewa na majira",
      "description": "Zungumza kuhusu upepo na mawingu, masika na kiangazi, na hali ya hewa ilivyokuwa jana."
    },
    "u13": {
      "title": "Wanyama",
      "description": "Wanyama wa shambani, wanyama vipenzi na wanyama pori wa mbugani."
    },
    "u14": {
      "title": "Kazi na ajira",
      "description": "Sema unachofanya, waulize wengine kuhusu kazi zao na zungumza kuhusu mshahara na likizo."
    },
    "u15": {
      "title": "Shule",
      "description": "Darasa, masomo, maswali, mitihani na kazi ya nyumbani."
    },
    "u16": {
      "title": "Safari",
      "description": "Nunua tiketi, panda treni au ndege, na sema utakachofanya."
    },
    "u17": {
      "title": "Kukataa",
      "description": "Sema usichotaka au usichopenda, kisicho kweli, na usichofanya au hutakachofanya."
    },
    "u18": {
      "title": "Kuuliza maswali",
      "description": "Uliza nini, kwa nini, vipi na ngapi, uliza umri wa mtu, na uliza kuhusu maneno."
    },
    "u19": {
      "title": "Nilichofanya",
      "description": "Sema ulichokwisha kufanya, ulichofanya jana na kilichotokea zamani."
    },
    "u20": {
      "title": "Mipango",
      "description": "Zungumza kuhusu kesho, wikendi na ndoto zako, na sema ungependa nini."
    },
    "u21": {
      "title": "Hisia",
      "description": "Sema unavyojisikia, shiriki habari njema na mbaya, na onyesha kujali."
    },
    "u22": {
      "title": "Burudani na michezo",
      "description": "Zungumza kuhusu muda wa mapumziko, mpira wa miguu, kuimba, kucheza densi na michezo."
    },
    "u23": {
      "title": "Kwenye simu",
      "description": "Piga simu, tuma ujumbe, nunua salio na panga kukutana."
    },
    "u24": {
      "title": "Upishi",
      "description": "Pika katika jiko la Kiswahili: kata, kaanga, chemsha na tia viungo kwenye sufuria ya pilau, kisha mle pamoja."
    },
    "u25": {
      "title": "Pwani ya Waswahili",
      "description": "Bandari, majahazi na miaka elfu ya biashara: pwani ambako Kiswahili kilizaliwa."
    },
    "u26": {
      "title": "Kijiji na kilimo",
      "description": "Maisha ya kijijini: kupanda, mavuno na kufanyiana mambo."
    },
    "u27": {
      "title": "Sherehe",
      "description": "Sikukuu, harusi na zawadi, na watu waliokuja, wakala na kucheza."
    },
    "u28": {
      "title": "Muziki na ngoma",
      "description": "Taarab, bongo flava na ngoma, na majina ya watu wanaotengeneza muziki."
    },
    "u29": {
      "title": "Imani na baraka",
      "description": "Nyumba za ibada, sala, kufunga na baraka watu wanazopeana."
    },
    "u30": {
      "title": "Biashara",
      "description": "Endesha biashara ndogo: wateja, faida na hasara, akiba, na kuwafundisha wengine kazi."
    },
    "u31": {
      "title": "Mazingira",
      "description": "Milima, maziwa, misitu na mito, na kutunza ardhi."
    },
    "u32": {
      "title": "Jamii",
      "description": "Mikutano, viongozi na kushirikiana: harambee."
    },
    "u33": {
      "title": "Kulinganisha",
      "description": "Sema kipi ni kikubwa zaidi, bora zaidi, bora kuliko vyote, sawa au tofauti."
    },
    "u34": {
      "title": "Kama na wakati",
      "description": "Zungumza kuhusu kinachotokea wakati fulani, ambacho kingetokea, na unachotamani."
    },
    "u35": {
      "title": "Kusimulia hadithi",
      "description": "Anza hadithi kwa njia ya Kiswahili, iendeleze na uimalize."
    },
    "u36": {
      "title": "Methali",
      "description": "Jifunze methali maarufu za Kiswahili, maana zake na wakati wa kuzitumia."
    },
    "u37": {
      "title": "Habari na maoni",
      "description": "Fuatilia habari, sema unachofikiri, na ukubali au ukatae kwa adabu."
    },
    "u38": {
      "title": "Dharura",
      "description": "Omba msaada, eleza kilichotokea na mtulize mtu."
    },
    "u39": {
      "title": "Heshima na adabu",
      "description": "Tembelea nyumba ya mtu, omba kwa adabu na onyesha heshima kwa njia ya Kiswahili."
    },
    "u40": {
      "title": "Hadithi za jadi",
      "description": "Mfahamu Sungura na Abunuwasi mjanja, na upate funzo katika hadithi."
    }
  },
  "skills": {
    "u1s1": "Salamu za kwanza",
    "u1s2": "Kujitambulisha",
    "u1s3": "Namba 1–10",
    "u2s1": "Familia yangu",
    "u2s2": "Nina na sina",
    "u2s3": "Watu",
    "u3s1": "Vinywaji",
    "u3s2": "Chakula",
    "u3s3": "Sokoni",
    "u4s1": "Namba hadi 100",
    "u4s2": "Kusema saa",
    "u4s3": "Leo na kesho",
    "u5s1": "Iko wapi?",
    "u5s2": "Maelekezo",
    "u5s3": "Safarini",
    "u6s1": "Vyumba",
    "u6s2": "Kuna na hakuna",
    "u6s3": "Rangi",
    "u7s1": "Siku za wiki",
    "u7s2": "Ratiba yangu",
    "u7s3": "Hali ya hewa",
    "u8s1": "Mwili",
    "u8s2": "Kinauma nini?",
    "u8s3": "Maneno ya huruma",
    "u9s1": "Nzuri, mbaya na mpya",
    "u9s2": "Kubwa na ndogo",
    "u9s3": "Kueleza watu",
    "u10s1": "Ninachovaa",
    "u10s2": "Kuvaa",
    "u10s3": "Kununua nguo",
    "u11s1": "Njoo ukae",
    "u11s2": "Kusafisha",
    "u11s3": "Kusaidia",
    "u12s1": "Jua, upepo na mawingu",
    "u12s2": "Majira",
    "u12s3": "Jana",
    "u13s1": "Wanyama wa shambani",
    "u13s2": "Wanyama pori",
    "u13s3": "Mbugani",
    "u14s1": "Kazi",
    "u14s2": "Kazini",
    "u14s3": "Kujipatia riziki",
    "u15s1": "Darasani",
    "u15s2": "Masomo",
    "u15s3": "Maswali na kazi ya nyumbani",
    "u16s1": "Tiketi na vituo",
    "u16s2": "Nitasafiri",
    "u16s3": "Barabarani",
    "u17s1": "Sitaki",
    "u17s2": "Si kweli, bado",
    "u17s3": "Sikufanya na sitafanya",
    "u18s1": "Nani na nini",
    "u18s2": "Vipi na ngapi",
    "u18s3": "Kwa nini, na maneno",
    "u19s1": "Leo hadi sasa",
    "u19s2": "Jana",
    "u19s3": "Zamani",
    "u20s1": "Kesho",
    "u20s2": "Wikendi hii",
    "u20s3": "Siku moja",
    "u21s1": "Furaha na huzuni",
    "u21s2": "Hasira na hofu",
    "u21s3": "Kuonyesha kujali",
    "u22s1": "Muda wa mapumziko",
    "u22s2": "Mpira wa miguu",
    "u22s3": "Muziki na michezo",
    "u23s1": "Kupiga simu",
    "u23s2": "Ujumbe",
    "u23s3": "Kukutana",
    "u24s1": "Jikoni",
    "u24s2": "Kupika pilau",
    "u24s3": "Kushiriki mlo",
    "u25s1": "Bahari na visiwa",
    "u25s2": "Biashara",
    "u25s3": "Miji ya kale",
    "u26s1": "Kijiji",
    "u26s2": "Kupanda na mavuno",
    "u26s3": "Kumfanyia mtu",
    "u27s1": "Sikukuu",
    "u27s2": "Harusi",
    "u27s3": "Waliokuja",
    "u28s1": "Wanaotengeneza muziki",
    "u28s2": "Kupiga na kusikiliza",
    "u29s1": "Mahali na sala",
    "u29s2": "Kuzaliwa na kuitwa",
    "u30s1": "Duka dogo",
    "u30s2": "Kuwafanya wengine",
    "u31s1": "Milima na maji",
    "u31s2": "Kutunza ardhi",
    "u32s1": "Mikutano na viongozi",
    "u32s2": "Kushirikiana",
    "u33s1": "Kubwa zaidi, ndogo zaidi",
    "u33s2": "Sawa na tofauti",
    "u34s1": "Wakati…",
    "u34s2": "Kama…",
    "u35s1": "Hapo zamani za kale",
    "u35s2": "Kisha",
    "u36s1": "Methali za kila siku",
    "u36s2": "Methali kuhusu watu",
    "u37s1": "Vichwa vya habari",
    "u37s2": "Kutoa maoni",
    "u37s3": "Kukubali na kukataa",
    "u38s1": "Msaada!",
    "u38s2": "Ajali",
    "u38s3": "Baada ya hatari",
    "u39s1": "Kuwasalimia wazee",
    "u39s2": "Maneno ya adabu",